{
  "video_id": "fixture-mat-armstrong",
  "creator": "Mat Armstrong (synthetic fixture)",
  "source_url": "https://example.invalid/local-fixture-only",
  "target_language": "te-IN",
  "source_transcript": "benchmark/fixtures/mat_armstrong_source.json",
  "target_transcript": "benchmark/fixtures/mat_armstrong_manual_target.json",
  "stt": {"enabled": false}
}
